いちばんやさしいJavaScriptの教本 第2版 ECMAScript 2017(ES8)対応 人気講師が教えるWebプログラミング入門	¥2,200＋税	2019/3/22	岩田 宇史　著
スラスラ読める Rubyふりがなプログラミング	¥2,000＋税	2019/3/15	リブロワークス　著/高橋 征義　監修
できるExcel関数 Office 365/2019/2016/2013/2010対応 データ処理の効率アップに役立つ本	¥1,580＋税	2019/3/14	尾崎 裕子　著/できるシリーズ編集部　著
年間70億円投資！行列ができる建築会社が実践する 最強ホテルプロジェクト	¥1,600＋税	2019/3/25	佐々木 数修都　著
できるポケット 時短の王道 Excel関数全事典 改訂版 Office 365 & Excel 2019/2016/2013/2010対応	¥1,380＋税	2019/3/22	羽山 博　著/吉川 明広　著/できるシリーズ編集部　著
おしゃれな季節とイベントのお知らせ＆チラシ素材集	¥1,980＋税	2019/3/14	Power Design　他著
ハンドメイド作家のための教科書 minneが教える売れるきほん帖	¥1,600＋税	2019/4/5	minne作家活動アドバイザー 和田まお　著
徹底攻略 ネットワークスペシャリスト教科書 2019年度	¥2,780＋税	2019/3/15	株式会社わくわくスタディワールド 瀬戸美月　著
できるポケット Windows 10 基本＆活用マスターブック 改訂4版	¥800＋税	2019/3/25	一ヶ谷兼乃　著/清水理史　著/できるシリーズ編集部　著/法林岳之　著
鉛筆一本ではじめる光と陰の描き方 ロジカルデッサンの技法	¥1,800＋税	2019/3/15	OCHABI Institute　著
いちばんやさしい資料作成＆プレゼンの教本 人気講師が教える「人の心つかむプレゼン」のすべて	¥1,980＋税	2019/4/5	髙橋惠一郎　著
風と土 Wind and Earth	¥3,000＋税	2019/3/8	岡嶋 和幸　著
Python機械学習ライブラリ scikit-learn活用レシピ80+	¥3,900＋税	2019/3/18	Julian Avila　著/Trent Hauck　著/株式会社クイープ　訳
Google Fonts・和文・多言語 フリーフォント最強Selections	¥2,380＋税	2019/3/15	インプレス編集部　編
ドローンビジネス調査報告書2019	¥100,000＋税	2019/3/27	春原 久徳　著/青山 祐介　著/インプレス総合研究所　著
気くばりメールはじめました！（できる for Woman）	¥1,300＋税	2019/3/25	西出 ひろ子　著
できるWord&Excel&PowerPoint 2019 Office 2019/Office 365両対応	¥1,480＋税	2019/3/25	井上 香緒里　著/できるシリーズ編集部　著
アートのロジックを読み解く 西洋美術の楽しみ方	¥1,980＋税	2019/3/25	OCHABI Institute　著
再起 東京ヤクルトスワローズ ～傘の花咲く、新たな夜明け～	¥1,800＋税	2019/3/15	長谷川 晶一　著
できるポケット Windows 10 困った！＆便利技215 改訂4版	¥880＋税	2019/3/25	広野 忠敏　著/できるシリーズ編集部　著
Amazon広告“打ち手”大全 世界最大のECサイトで広告運用に挑む 最強の戦略70（できるMarketing Bible）	¥2,500＋税	2019/3/22	鳴海拓也　著/寳 洋平　著
できる 大人の手習い帖 LINE 知りたいこと100選	¥1,200＋税	2019/3/8	エディポック　著/できるシリーズ編集部　著
できる 大人の手習い帖 スマホ 知りたいこと100選	¥1,200＋税	2019/3/8	エディポック　著/できるシリーズ編集部　著
できる 大人の手習い帖 スマホ 知りたいこと100選	¥1,200＋税	2019/3/8	エディポック　著/できるシリーズ編集部　著
ヒット商品のマル秘プレゼン資料を大公開！ 資料から読み解く成功の極意	¥1,600＋税	2019/3/22	戸田 覚　著
スッキリわかるサーブレット＆JSP入門 第2版	¥2,800＋税	2019/3/25	国本 大悟　著/株式会社フレアリンク　監修
できる 大人の手習い帖 LINE 知りたいこと100選	¥1,200＋税	2019/3/8	エディポック　著/できるシリーズ編集部　著
僕でもできた！ 「おもしろい」を仕事にする（しごとのわ）	¥1,600＋税	2019/3/15	松本 圭司　著
Ethereum＋Solidity入門 Web3.0を切り拓くブロックチェーンの思想と技術	¥3,500＋税	2019/3/18	Chris Dannen　著/ウイリング　訳/ICOVO AG　監訳
特濃！あなたの知らない秋葉原オタクスポットガイド	¥1,380＋税	2019/3/25	髙橋 敏也　著
できるExcelマクロ＆VBA Office 365/2019/2016/2013/2010対応 作業の効率化＆時短に役立つ本	¥1,800＋税	2019/3/14	小舘 由典　著/できるシリーズ編集部　著
できるfit メルカリ&LINE&Instagram&Facebook&Twitter 基本+活用ワザ	¥1,480＋税	2019/3/8	田口 和裕　著/森嶋 良子　著/毛利 勝久　著/できるシリーズ編集部　著
